{
    "distro": "AzureLinux",
    "version": "3",
    "arch": "x86_64",
    "packages": [
        "cloud-init",        
        "cloud-utils-growpart",
        "dhcpcd",        
        "grubby",
        "hyperv-daemons",
        "netplan",        
        "python3",
        "rsyslog",
        "sgx-backwards-compatibility",
        "WALinuxAgent",        
        "wireless-regdb",
        "zstd-devel-1.5.5-2.azl3.x86_64.rpm"     
    ],
    "immutable": false,
    "output": "iso",
    "kernel": {"version":"6.12"}
}
