{
    "distro": "eLxr",
    "version": "12",
    "arch": "x86_64",
    "packages": [
        "systemd-boot",
        "dracut",
        "linux-image-amd64",
        "ca-certificates",
        "vim",
        "sudo",
        "net-tools",
        "openssh-client",
        "openssh-server",
        "procps",
        "less",
        "dbus",
        "policykit-1",
        "curl",
        "wget",
        "ca-certificates",
        "ostree",
        "ostree-boot",
        "python3-apt-ostree",
        "uefi-ext4",
        "systemd-resolved",
        "cloud-guest-utils",
        "xterm"
    ],
    "immutable": true,
    "output": "raw",
    "kernel": { "version": "6.12", "cmdline": "quiet splash" }
}
