{
    "distro": "AzureLinux",
    "version": "3",
    "arch": "x86_64",
    "packages": [
		"bash",
        "ca-certificates",
        "ca-certificates-base",
        "dbus",
        "dracut-hostonly",
        "e2fsprogs",
        "filesystem",
        "grub2",
        "grub2-efi-binary",
        "iana-etc",
        "initramfs",
        "iproute",
        "iputils",
        "irqbalance",
        "ncurses-libs",
        "openssl",
        "rpm",
        "rpm-libs",
        "shadow-utils",
        "shim",
        "sudo",
        "systemd",
        "systemd-networkd",
        "systemd-resolved",
        "systemd-udev",
        "tdnf",
        "tdnf-plugin-repogpgcheck",
        "util-linux",
        "zlib"
	],
    "immutable": true,
    "output": "raw",
    "kernel": { "version": "6.12", "cmdline": "quiet splash" }
}
